CPU:
   0x00000000 0x00: eax=0x00000020 ebx=0x756e6547 ecx=0x6c65746e edx=0x49656e69
   0x00000001 0x00: eax=0x000b0671 ebx=0x01800800 ecx=0x7ffafbff edx=0xbfebfbff
   0x00000002 0x00: eax=0x00feff01 ebx=0x000000f0 ecx=0x00000000 edx=0x00000000
   0x00000003 0x00: eax=0x00000000 ebx=0x00000000 ecx=0x00000000 edx=0x00000000
   0x00000004 0x00: eax=0xfc004121 ebx=0x02c0003f ecx=0x0000003f edx=0x00000000
   0x00000004 0x01: eax=0xfc004122 ebx=0x01c0003f ecx=0x0000003f edx=0x00000000
   0x00000004 0x02: eax=0xfc01c143 ebx=0x03c0003f ecx=0x000007ff edx=0x00000000
   0x00000004 0x03: eax=0xfc1fc163 ebx=0x02c0003f ecx=0x0000bfff edx=0x00000004
   0x00000004 0x04: eax=0x00000000 ebx=0x00000000 ecx=0x00000000 edx=0x00000000
   0x00000005 0x00: eax=0x00000040 ebx=0x00000040 ecx=0x00000003 edx=0x10102020
   0x00000006 0x00: eax=0x00dfcff7 ebx=0x00000002 ecx=0x00000409 edx=0x00000003
   0x00000007 0x00: eax=0x00000002 ebx=0x239c27eb ecx=0x98c027bc edx=0xfc1cc410
   0x00000007 0x01: eax=0x00400810 ebx=0x00000000 ecx=0x00000000 edx=0x00000000
   0x00000007 0x02: eax=0x00000000 ebx=0x00000000 ecx=0x00000000 edx=0x0000001f
   0x00000008 0x00: eax=0x00000000 ebx=0x00000000 ecx=0x00000000 edx=0x00000000
   0x00000009 0x00: eax=0x00000000 ebx=0x00000000 ecx=0x00000000 edx=0x00000000
   0x0000000a 0x00: eax=0x07300605 ebx=0x00000000 ecx=0x00000007 edx=0x00008603
   0x0000000b 0x00: eax=0x00000001 ebx=0x00000002 ecx=0x00000100 edx=0x00000001
   0x0000000b 0x01: eax=0x00000007 ebx=0x00000020 ecx=0x00000201 edx=0x00000001
   0x0000000b 0x02: eax=0x00000000 ebx=0x00000000 ecx=0x00000002 edx=0x00000001
   0x0000000c 0x00: eax=0x00000000 ebx=0x00000000 ecx=0x00000000 edx=0x00000000
   0x0000000d 0x00: eax=0x00000207 ebx=0x00000a88 ecx=0x00000a88 edx=0x00000000
   0x0000000d 0x01: eax=0x0000000f ebx=0x00000670 ecx=0x00019900 edx=0x00000000
   0x0000000d 0x02: eax=0x00000100 ebx=0x00000240 ecx=0x00000000 edx=0x00000000
   0x0000000d 0x08: eax=0x00000080 ebx=0x00000000 ecx=0x00000001 edx=0x00000000
   0x0000000d 0x09: eax=0x00000008 ebx=0x00000a80 ecx=0x00000000 edx=0x00000000
   0x0000000d 0x0b: eax=0x00000010 ebx=0x00000000 ecx=0x00000001 edx=0x00000000
   0x0000000d 0x0c: eax=0x00000018 ebx=0x00000000 ecx=0x00000001 edx=0x00000000
   0x0000000d 0x0f: eax=0x00000328 ebx=0x00000000 ecx=0x00000001 edx=0x00000000
   0x0000000d 0x10: eax=0x00000008 ebx=0x00000000 ecx=0x00000001 edx=0x00000000
   0x0000000e 0x00: eax=0x00000000 ebx=0x00000000 ecx=0x00000000 edx=0x00000000
   0x0000000f 0x00: eax=0x00000000 ebx=0x00000000 ecx=0x00000000 edx=0x00000000
   0x00000010 0x00: eax=0x00000000 ebx=0x00000000 ecx=0x00000000 edx=0x00000000
   0x00000011 0x00: eax=0x00000000 ebx=0x00000000 ecx=0x00000000 edx=0x00000000
   0x00000012 0x00: eax=0x00000000 ebx=0x00000000 ecx=0x00000000 edx=0x00000000
   0x00000012 0x01: eax=0x00000000 ebx=0x00000000 ecx=0x00000000 edx=0x00000000
   0x00000012 0x02: eax=0x00000000 ebx=0x00000000 ecx=0x00000000 edx=0x00000000
   0x00000013 0x00: eax=0x00000000 ebx=0x00000000 ecx=0x00000000 edx=0x00000000
   0x00000014 0x00: eax=0x00000001 ebx=0x0000005f ecx=0x00000007 edx=0x00000000
   0x00000014 0x01: eax=0x02490002 ebx=0x003f003f ecx=0x00000000 edx=0x00000000
   0x00000015 0x00: eax=0x00000002 ebx=0x0000009c ecx=0x0249f000 edx=0x00000000
   0x00000016 0x00: eax=0x00000bb8 ebx=0x000016a8 ecx=0x00000064 edx=0x00000000
   0x00000017 0x00: eax=0x00000000 ebx=0x00000000 ecx=0x00000000 edx=0x00000000
   0x00000018 0x00: eax=0x00000008 ebx=0x00000000 ecx=0x00000000 edx=0x00000000
   0x00000018 0x01: eax=0x00000000 ebx=0x00080001 ecx=0x00000020 edx=0x00004022
   0x00000018 0x02: eax=0x00000000 ebx=0x00080006 ecx=0x00000004 edx=0x00004022
   0x00000018 0x03: eax=0x00000000 ebx=0x0010000f ecx=0x00000001 edx=0x00004125
   0x00000018 0x04: eax=0x00000000 ebx=0x00040001 ecx=0x00000010 edx=0x00004024
   0x00000018 0x05: eax=0x00000000 ebx=0x00040006 ecx=0x00000008 edx=0x00004024
   0x00000018 0x06: eax=0x00000000 ebx=0x00080008 ecx=0x00000001 edx=0x00004124
   0x00000018 0x07: eax=0x00000000 ebx=0x00080007 ecx=0x00000080 edx=0x00004043
   0x00000018 0x08: eax=0x00000000 ebx=0x00080009 ecx=0x00000080 edx=0x00004043
   0x00000019 0x00: eax=0x00000007 ebx=0x00000014 ecx=0x00000003 edx=0x00000000
   0x0000001a 0x00: eax=0x40000001 ebx=0x00000000 ecx=0x00000000 edx=0x00000000
   0x0000001b 0x00: eax=0x00000001 ebx=0x00000001 ecx=0x00000000 edx=0x00000000
   0x0000001b 0x01: eax=0x00000000 ebx=0x00000000 ecx=0x00000000 edx=0x00000000
   0x0000001c 0x00: eax=0x4000000b ebx=0x00000007 ecx=0x00000007 edx=0x00000000
   0x0000001d 0x00: eax=0x00000000 ebx=0x00000000 ecx=0x00000000 edx=0x00000000
   0x0000001e 0x00: eax=0x00000000 ebx=0x00000000 ecx=0x00000000 edx=0x00000000
   0x0000001f 0x00: eax=0x00000001 ebx=0x00000002 ecx=0x00000100 edx=0x00000001
   0x0000001f 0x01: eax=0x00000007 ebx=0x00000020 ecx=0x00000201 edx=0x00000001
   0x0000001f 0x02: eax=0x00000000 ebx=0x00000000 ecx=0x00000002 edx=0x00000001
   0x00000020 0x00: eax=0x00000000 ebx=0x00000001 ecx=0x00000000 edx=0x00000000
   0x20000000 0x00: eax=0x00000000 ebx=0x00000001 ecx=0x00000000 edx=0x00000000
   0x80000000 0x00: eax=0x80000008 ebx=0x00000000 ecx=0x00000000 edx=0x00000000
   0x80000001 0x00: eax=0x00000000 ebx=0x00000000 ecx=0x00000121 edx=0x2c100800
   0x80000002 0x00: eax=0x68743331 ebx=0x6e654720 ecx=0x746e4920 edx=0x52286c65
   0x80000003 0x00: eax=0x6f432029 ebx=0x54286572 ecx=0x6920294d edx=0x33312d39
   0x80000004 0x00: eax=0x4b303039 ebx=0x00000000 ecx=0x00000000 edx=0x00000000
   0x80000005 0x00: eax=0x00000000 ebx=0x00000000 ecx=0x00000000 edx=0x00000000
   0x80000006 0x00: eax=0x00000000 ebx=0x00000000 ecx=0x08007040 edx=0x00000000
   0x80000007 0x00: eax=0x00000000 ebx=0x00000000 ecx=0x00000000 edx=0x00000100
   0x80000008 0x00: eax=0x0000302e ebx=0x00000000 ecx=0x00000000 edx=0x00000000
   0x80860000 0x00: eax=0x00000000 ebx=0x00000001 ecx=0x00000000 edx=0x00000000
   0xc0000000 0x00: eax=0x00000000 ebx=0x00000001 ecx=0x00000000 edx=0x00000000
